{
  "schemaVersion": "2.0.0",
  "tenant": "shaw",
  "clientSafe": true,
  "asOf": "2026-07-23",
  "metrics": {
    "projectsActive": {
      "count": 1,
      "descriptor": "active film",
      "label": "Film 3 - AI Advisor awaits direction lock; Film 4 - Insight is planned"
    },
    "deliverablesCompleted": {
      "count": 6,
      "descriptor": "deliverables",
      "label": "6 completed deliverables across films and supporting engagements"
    },
    "hoursInvested": {
      "hours": 614,
      "descriptor": "hours",
      "label": "614 total hours across Shaw projects — 324 billable and 290 partnership/R&D"
    },
    "capabilitiesDelivered": {
      "count": 5,
      "descriptor": "capabilities",
      "label": "Films, training, agent architecture, loop videos, and conference AV"
    }
  },
  "capabilities": [
    {
      "title": "AI Film Production",
      "type": "knowledge",
      "description": "Full AI-powered video production pipeline — storyboarding, stills, video generation, and editing.",
      "status": "active"
    },
    {
      "title": "Conference AV + Live Production",
      "type": "service",
      "description": "Live conference AV support, lighting, and logo video assets.",
      "status": "active"
    },
    {
      "title": "Team Training",
      "type": "knowledge",
      "description": "Hands-on training sessions on AI-powered workflows for the Shaw marketing team.",
      "status": "active"
    },
    {
      "title": "Agent Architecture",
      "type": "tool",
      "description": "Custom workflow and agent architecture for Shaw's marketing operations (40 hours goodwill).",
      "status": "active"
    },
    {
      "title": "Loop Video Assets",
      "type": "tool",
      "description": "Reusable logo sequence loop videos for conferences and digital displays.",
      "status": "active"
    }
  ],
  "narrative": {
    "summary": "Third i's Shaw production system improves with each completed film. The Value & Results hero compares the expected efficiency trajectory with verified actual results while financial, delivery, and quality evidence accumulate below.",
    "faster": "Shaw Systems Film 1 established a baseline of 150 production hours per finished minute. Shaw Systems Film 2 improved to 120 hours per finished minute. Future Shaw films are in development and are expected to require less time.",
    "smarter": "Each Shaw project can reuse Shaw-approved brand knowledge, production methods, and quality checks. Other clients' source files, prompts, private knowledge, credentials, and generated assets remain isolated and never enter Shaw's workspace.",
    "expanding": "Future projects will add verified evidence for total hours, weeks to completion, approved deliverables, review efficiency, financial context, and reusable capabilities without relying on invented quality scores."
  },
  "completedProjects": [
    {
      "title": "Film 1 - Shaw Integration",
      "completedAt": "2026 conference",
      "hours": 250,
      "amount": "$2,500",
      "outcome": "Complete — fixed-bid pre-contract"
    },
    {
      "title": "Logo Loop Video + Conference Week",
      "completedAt": "April",
      "hours": 35,
      "amount": "$2,100",
      "outcome": "Complete"
    },
    {
      "title": "Film 2 - Amplify V1 and V2",
      "completedAt": "May-Jun 2026",
      "hours": 119,
      "amount": "$7,140",
      "outcome": "Complete"
    },
    {
      "title": "Training",
      "completedAt": "June",
      "hours": 7,
      "amount": "$420",
      "outcome": "Complete"
    },
    {
      "title": "Agent Upgrades (unbillable)",
      "completedAt": "May",
      "hours": 40,
      "amount": "$0",
      "outcome": "Complete"
    }
  ],
  "efficiencyTrend": [],
  "efficiencyModel": {
    "minCompletedProjects": 2,
    "completedProjectCount": 2,
    "unit": "hours per finished minute",
    "futureLabel": "Future Shaw films",
    "projects": [
      {
        "label": "Shaw Systems Film 1",
        "status": "completed",
        "actualHoursPerMinute": 150
      },
      {
        "label": "Shaw Systems Film 2",
        "status": "completed",
        "actualHoursPerMinute": 120
      }
    ]
  },
  "learningPrivacy": {
    "title": "Built on Shaw work. Isolated to Shaw.",
    "description": "Third i can reuse Shaw-approved production methods and brand knowledge across Shaw projects. No other client's files, prompts, private knowledge, credentials, or generated assets enter this workspace.",
    "carriesForward": [
      "Shaw-approved production methods and tooling",
      "Shaw brand knowledge and project feedback",
      "Quality-control patterns verified on completed Shaw work"
    ],
    "staysPrivate": [
      "Every other client's source files and generated assets",
      "Other-client prompts, credentials, and private knowledge",
      "Other-client feedback, strategy, and project records"
    ]
  },
  "futureValueSections": [
    {
      "title": "Delivery speed",
      "icon": "clock",
      "statusLabel": "Ready to track",
      "description": "Shows whether production becomes faster across completed projects.",
      "metrics": [
        "Total hours",
        "Weeks to completion",
        "Hours per finished minute"
      ]
    },
    {
      "title": "Deliverable quality",
      "icon": "checkCircle",
      "statusLabel": "Ready to track",
      "description": "Uses approval evidence instead of an invented quality score.",
      "metrics": [
        "Approved deliverables",
        "Review rounds",
        "Rework hours"
      ]
    },
    {
      "title": "Output volume",
      "icon": "layers",
      "statusLabel": "Ready to track",
      "description": "Records how much finished, Shaw-approved work each project produces.",
      "metrics": [
        "Deliverables",
        "Finished minutes",
        "Approved versions"
      ]
    },
    {
      "title": "Financial return",
      "icon": "chart",
      "statusLabel": "Ready to track",
      "description": "Adds comparable financial context after project scope and billing are confirmed.",
      "metrics": [
        "Cost per deliverable",
        "Effective rate",
        "Value over baseline"
      ]
    },
    {
      "title": "Compounding capability",
      "icon": "sparkles",
      "statusLabel": "Ready to track",
      "description": "Shows the reusable systems and Shaw-specific capabilities added by each project.",
      "metrics": [
        "Capabilities added",
        "Reusable components",
        "Next-project time saved"
      ]
    },
    {
      "title": "Project confidence",
      "icon": "target",
      "statusLabel": "Ready to track",
      "description": "Compares plans with completed results using Shaw-owned records only.",
      "metrics": [
        "Expected vs. actual",
        "Milestone accuracy",
        "Decision turnaround"
      ]
    }
  ],
  "financialSummary": {
    "totalBilled": 21870,
    "totalPaid": 17910,
    "outstanding": 3960,
    "totalHours": 614,
    "billableHours": 324,
    "partnershipHours": 290,
    "activeProjects": 1,
    "completedProjects": 5,
    "effectiveRate": 67.5,
    "formattedBilled": "$21,870",
    "formattedPaid": "$17,910",
    "formattedOutstanding": "$3,960"
  },
  "source": "Extracted from OS snapshot (Google Sheets time tracking + project management) via extract-metrics.mjs"
}
